id,scene_name,description,created_at,updated_at
150,MyDataScene::MainPageCharacterSelectPage,メインページに表示するキャラクターの設定が行えます。,2024-01-11 00:37:30,2024-01-11 00:37:30
151,MyDataScene::SubPage,キャラクター別の出撃回数や各イベントのクリア回数を確認することができます。,2024-01-11 00:37:30,2024-01-11 00:37:30
152,MyDataScene::AchievementCategoryListPage,称号の獲得条件の確認とメインページに表示する称号の付け替えが行えます。,2024-01-11 00:37:30,2024-01-11 00:37:30
153,MyDataScene::AchievementListPage,称号の獲得条件の確認とメインページに表示する称号の付け替えが行えます。,2024-01-11 00:37:30,2024-01-11 00:37:30
154,MyDataScene::AchievementDetailPage,称号の獲得条件の確認とメインページに表示する称号の付け替えが行えます。,2024-01-11 00:37:30,2024-01-11 00:37:30
155,TeamMemberSelectSupporterScene,フレンドに貸し出すことのできるキャラクターを選択できます。,2024-01-11 00:37:30,2024-01-11 00:37:30
156,JukeboxScene::AlbumList,アルバムを選択してください。,2024-01-11 00:37:30,2024-01-11 00:37:30
157,JukeboxScene::TrackList,再生したい曲を選択してください。詳細は「？」ボタンから確認してください。,2024-01-11 00:37:30,2024-01-11 00:37:30
158,SupportMemory::EnhancementItemScene,タップで詳細を確認できます。,2024-01-11 00:37:30,2024-01-11 00:37:30
159,LINEScene,LINEアカウントとの連携、解除が行えます。,2024-01-11 00:37:30,2024-01-11 00:37:30
160,CharacterGrowthRootScene::Training,修業で強化させるキャラクターを選択してください。,2024-01-11 00:37:30,2024-01-11 00:37:30
161,CharacterGrowthRootScene::Awakening,覚醒させるキャラクターを選択してください。,2024-01-11 00:37:30,2024-01-11 00:37:30
162,CharacterGrowthRootScene::LinkSkill,リンクスキルLvUPさせるキャラクターを選択してください。,2024-01-11 00:37:30,2024-01-11 00:37:30
163,LinkSkillLvUpScene,Lvを上げたいリンクスキルを選択してください。まとめてLvUPでは全リンクスキルのLvを一括で操作することができます。,2024-01-11 00:37:30,2024-01-11 00:37:30
164,UserScoreBenefitScene,発動中の戦闘力ボーナスを確認できます。,2024-01-11 00:37:30,2024-01-11 00:37:30
165,UserScoreBenefitAllListScene,戦闘力ボーナスを確認できます。,2024-01-11 00:37:30,2024-01-11 00:37:30
